{
  "$schema": "http://json-schema.org/draft-07/schema#",
  "title": "EmployeeFeatures",
  "type": "object",
  "properties": {
    "employee_id": { "type": "integer" },
    "age": { "type": "number" },
    "gender": { "type": "string" },
    "education": { "type": "string" },
    "department": { "type": "string" },
    "job_level": { "type": "integer" },
    "years_at_company": { "type": "number" },
    "years_in_current_role": { "type": "number" },
    "monthly_salary": { "type": "number" },
    "overtime_hours_monthly": { "type": "integer" },
    "num_projects_completed": { "type": "integer" },
    "performance_rating": { "type": "integer" },
    "training_hours_yearly": { "type": "number" },
    "work_life_balance_score": { "type": "integer" },
    "distance_from_home_km": { "type": "number" },
    "num_companies_worked": { "type": "integer" },
    "job_satisfaction": { "type": "integer" },
    "relationship_with_manager": { "type": "integer" },
    "stock_option_level": { "type": "integer" }
  },
  "required": [
    "employee_id",
    "age",
    "gender",
    "education",
    "department",
    "job_level",
    "years_at_company",
    "years_in_current_role",
    "monthly_salary",
    "overtime_hours_monthly",
    "num_projects_completed",
    "performance_rating",
    "training_hours_yearly",
    "work_life_balance_score",
    "distance_from_home_km",
    "num_companies_worked",
    "job_satisfaction",
    "relationship_with_manager",
    "stock_option_level"
  ]
}
