{
  "employee_id": 13981,
  "age": 51.0,
  "gender": "Male",
  "education": "Master",
  "department": "IT",
  "job_level": 2,
  "years_at_company": 1.3,
  "years_in_current_role": 0.4,
  "monthly_salary": 4142.39,
  "overtime_hours_monthly": 12,
  "num_projects_completed": 5,
  "performance_rating": 2,
  "training_hours_yearly": 53.3,
  "work_life_balance_score": 4,
  "distance_from_home_km": 15.0,
  "num_companies_worked": 3,
  "job_satisfaction": 5,
  "relationship_with_manager": 4,
  "stock_option_level": 1
}
